{
  "$schema": "./schemas/catalog.schema.json",
  "catalog_version": "0.1.0",
  "status": "draft",
  "last_reviewed": "2026-10-14",
  "claims": [
    {
      "id": "woh-claim-0001",
      "title": "Elohim-civilization hypothesis",
      "version": "0.2.0",
      "lifecycle": "accepted",
      "claim_kind": "hypothesis",
      "framework_relation": "foundational",
      "record": "claims/woh-claim-0001.json",
      "specification": "../docs/framework/elohim-civilization-hypothesis.md"
    },
    {
      "id": "woh-claim-0002",
      "title": "Anunnaki–Elohim identity",
      "version": "0.1.0",
      "lifecycle": "accepted",
      "claim_kind": "interpretation",
      "framework_relation": "comparative",
      "record": "claims/woh-claim-0002.json",
      "specification": "../docs/framework/anunnaki-elohim-identity.md"
    },
    {
      "id": "woh-claim-0003",
      "title": "Precessional world-age chronology",
      "version": "0.1.0",
      "lifecycle": "accepted",
      "claim_kind": "model",
      "framework_relation": "foundational",
      "record": "claims/woh-claim-0003.json",
      "specification": "../docs/framework/precessional-world-age-chronology.md"
    },
    {
      "id": "woh-claim-0004",
      "title": "Greek theomachy as Council–Serpentine conflict memory",
      "version": "0.2.0",
      "lifecycle": "accepted",
      "claim_kind": "interpretation",
      "framework_relation": "comparative",
      "record": "claims/woh-claim-0004.json",
      "specification": "../docs/framework/greek-theomachy-memory.md"
    },
    {
      "id": "woh-claim-0005",
      "title": "Near Eastern literary transmission to archaic Greece",
      "version": "0.2.0",
      "lifecycle": "accepted",
      "claim_kind": "empirical_observation",
      "framework_relation": "contextual",
      "record": "claims/woh-claim-0005.json",
      "specification": "../docs/framework/near-eastern-transmission-to-greece.md"
    },
    {
      "id": "woh-claim-0006",
      "title": "Post-Homeric emissary transfer to Persia and Greece",
      "version": "0.1.0",
      "lifecycle": "accepted",
      "claim_kind": "interpretation",
      "framework_relation": "derived",
      "record": "claims/woh-claim-0006.json",
      "specification": "../docs/framework/post-homeric-emissary-transfer.md"
    },
    {
      "id": "woh-claim-0007",
      "title": "Greece within the Elohimian sphere",
      "version": "0.1.0",
      "lifecycle": "accepted",
      "claim_kind": "interpretation",
      "framework_relation": "derived",
      "record": "claims/woh-claim-0007.json",
      "specification": "../docs/framework/greece-elohimian-sphere.md"
    },
    {
      "id": "woh-claim-0008",
      "title": "The Council–Serpentine conflict",
      "version": "0.1.0",
      "lifecycle": "accepted",
      "claim_kind": "interpretation",
      "framework_relation": "derived",
      "record": "claims/woh-claim-0008.json",
      "specification": "../docs/framework/council-serpentine-conflict.md"
    },
    {
      "id": "woh-claim-0009",
      "title": "The Elohim plural and the canonical gloss",
      "version": "0.1.1",
      "lifecycle": "accepted",
      "claim_kind": "interpretation",
      "framework_relation": "derived",
      "record": "claims/woh-claim-0009.json",
      "specification": "../docs/framework/elohim-plural-gloss.md"
    },
    {
      "id": "woh-claim-0010",
      "title": "The Flood as deliberate reset",
      "version": "0.1.0",
      "lifecycle": "accepted",
      "claim_kind": "interpretation",
      "framework_relation": "derived",
      "record": "claims/woh-claim-0010.json",
      "specification": "../docs/framework/flood-as-reset.md"
    },
    {
      "id": "woh-claim-0011",
      "title": "Monotheism as re-description of the plural Elohim",
      "version": "0.1.0",
      "lifecycle": "accepted",
      "claim_kind": "interpretation",
      "framework_relation": "derived",
      "record": "claims/woh-claim-0011.json",
      "specification": "../docs/framework/monotheism-redescription.md"
    },
    {
      "id": "woh-claim-0012",
      "title": "Watchers and Nephilim as the exile-era unions",
      "version": "0.1.0",
      "lifecycle": "accepted",
      "claim_kind": "interpretation",
      "framework_relation": "comparative",
      "record": "claims/woh-claim-0012.json",
      "specification": "../docs/framework/watchers-nephilim-unions.md"
    },
    {
      "id": "woh-claim-0013",
      "title": "Lucifer and Satan as distinct figures",
      "version": "0.1.0",
      "lifecycle": "accepted",
      "claim_kind": "interpretation",
      "framework_relation": "comparative",
      "record": "claims/woh-claim-0013.json",
      "specification": "../docs/framework/lucifer-satan-distinction.md"
    },
    {
      "id": "woh-claim-0014",
      "title": "Precessional knowledge encoded in myth",
      "version": "0.1.0",
      "lifecycle": "accepted",
      "claim_kind": "interpretation",
      "framework_relation": "comparative",
      "record": "claims/woh-claim-0014.json",
      "specification": "../docs/framework/precessional-myth-encoding.md"
    },
    {
      "id": "woh-claim-0015",
      "title": "The Great Return as conditional arrival",
      "version": "0.1.0",
      "lifecycle": "accepted",
      "claim_kind": "interpretation",
      "framework_relation": "derived",
      "record": "claims/woh-claim-0015.json",
      "specification": "../docs/framework/great-return-conditional.md"
    },
    {
      "id": "woh-claim-0016",
      "title": "The Embassy as the Third Temple",
      "version": "0.1.0",
      "lifecycle": "accepted",
      "claim_kind": "interpretation",
      "framework_relation": "derived",
      "record": "claims/woh-claim-0016.json",
      "specification": "../docs/framework/embassy-third-temple.md"
    },
    {
      "id": "woh-claim-0017",
      "title": "Babel as the pardon expedition and its dispersal",
      "version": "0.1.0",
      "lifecycle": "accepted",
      "claim_kind": "interpretation",
      "framework_relation": "derived",
      "record": "claims/woh-claim-0017.json",
      "specification": "../docs/framework/babel-pardon-expedition.md"
    },
    {
      "id": "woh-claim-0018",
      "title": "Eden as the Israel team's operational territory",
      "version": "0.1.0",
      "lifecycle": "accepted",
      "claim_kind": "interpretation",
      "framework_relation": "derived",
      "record": "claims/woh-claim-0018.json",
      "specification": "../docs/framework/eden-operational-territory.md"
    },
    {
      "id": "woh-claim-0019",
      "title": "The antediluvian civilization",
      "version": "0.1.0",
      "lifecycle": "accepted",
      "claim_kind": "interpretation",
      "framework_relation": "derived",
      "record": "claims/woh-claim-0019.json",
      "specification": "../docs/framework/antediluvian-civilization.md"
    },
    {
      "id": "woh-claim-0020",
      "title": "The contact reports as the canon's provenance",
      "version": "0.1.0",
      "lifecycle": "accepted",
      "claim_kind": "source_report",
      "framework_relation": "contextual",
      "record": "claims/woh-claim-0020.json",
      "specification": "../docs/framework/contact-reports-provenance.md"
    },
    {
      "id": "woh-claim-0021",
      "title": "The Kabbalah ranking and its Shi'ur Qomah anchor",
      "version": "0.1.0",
      "lifecycle": "accepted",
      "claim_kind": "interpretation",
      "framework_relation": "comparative",
      "record": "claims/woh-claim-0021.json",
      "specification": "../docs/framework/kabbalah-shiur-qomah-anchor.md"
    },
    {
      "id": "woh-claim-0022",
      "title": "The serpent vocabulary as faction memory",
      "version": "0.1.0",
      "lifecycle": "accepted",
      "claim_kind": "interpretation",
      "framework_relation": "derived",
      "record": "claims/woh-claim-0022.json",
      "specification": "../docs/framework/serpent-vocabulary-referent.md"
    },
    {
      "id": "woh-claim-0023",
      "title": "Fractal cosmology: the infinite in both directions",
      "version": "0.1.0",
      "lifecycle": "accepted",
      "claim_kind": "interpretation",
      "framework_relation": "foundational",
      "record": "claims/woh-claim-0023.json",
      "specification": "../docs/framework/fractal-cosmology-frame.md"
    },
    {
      "id": "woh-claim-0024",
      "title": "The early-qibla convergence on Petra",
      "version": "0.1.0",
      "lifecycle": "accepted",
      "claim_kind": "interpretation",
      "framework_relation": "comparative",
      "record": "claims/woh-claim-0024.json",
      "specification": "../docs/framework/early-qibla-convergence.md"
    },
    {
      "id": "woh-claim-0025",
      "title": "Macrobiology: humanity as organism one scale up",
      "version": "0.1.0",
      "lifecycle": "accepted",
      "claim_kind": "model",
      "framework_relation": "derived",
      "record": "claims/woh-claim-0025.json",
      "specification": "../docs/framework/macrobiology-proposal.md"
    },
    {
      "id": "woh-claim-0026",
      "title": "The Year One unsealing reading",
      "version": "0.1.0",
      "lifecycle": "accepted",
      "claim_kind": "interpretation",
      "framework_relation": "derived",
      "record": "claims/woh-claim-0026.json",
      "specification": "../docs/framework/year-one-unsealing.md"
    },
    {
      "id": "woh-claim-0027",
      "title": "The canon's self-description as religion of religions",
      "version": "0.1.0",
      "lifecycle": "accepted",
      "claim_kind": "source_report",
      "framework_relation": "contextual",
      "record": "claims/woh-claim-0027.json",
      "specification": "../docs/framework/religion-of-religions-self-description.md"
    },
    {
      "id": "woh-claim-0028",
      "title": "Yahweh as Council president",
      "version": "0.1.0",
      "lifecycle": "accepted",
      "claim_kind": "interpretation",
      "framework_relation": "derived",